{
  "id": "5a401af8-d2e2-4090-8c45-9f87b8b6c4d1",
  "name": "Example Name",
  "description": "string",
  "type": "SINGLE",
  "images": [
    "string"
  ],
  "availableOptions": [
    {
      "id": "5a401af8-d2e2-4090-8c45-9f87b8b6c4d1",
      "name": "Example Name",
      "sortOrder": 1,
      "values": [
        {}
      ]
    }
  ]
}